{
  "$schema": "https://json-schema.org/draft/2020-12/schema",
  "$id": "https://github.com/asnad68/NOTHING/blob/main/schema/identity.schema.json",
  "title": "NOTHING Business Identity Record",
  "description": "Experimental machine-readable identity record for the NOTHING project.",
  "type": "object",
  "additionalProperties": false,
  "required": [
    "nothing_id",
    "version",
    "subject",
    "claims"
  ],
  "properties": {
    "nothing_id": {
      "type": "string",
      "pattern": "^NTH-[0-9]{6}$"
    },
    "version": {
      "type": "string",
      "const": "0.1"
    },
    "subject": {
      "type": "object",
      "additionalProperties": false,
      "required": [
        "name",
        "type"
      ],
      "properties": {
        "name": {
          "type": "string",
          "minLength": 1
        },
        "type": {
          "type": "string",
          "enum": [
            "business",
            "brand",
            "digital_channel",
            "authorized_agent",
            "other"
          ]
        },
        "website": {
          "type": "string",
          "minLength": 1,
          "pattern": "^[A-Za-z][A-Za-z0-9+.-]*:[^\\s]+$"
        }
      }
    },
    "claims": {
      "type": "array",
      "items": {
        "$ref": "#/$defs/claim"
      }
    },
    "revocation": {
      "type": "object",
      "additionalProperties": false,
      "properties": {
        "status": {
          "type": "string",
          "enum": [
            "NOT_REVOKED",
            "REVOKED"
          ]
        },
        "reason": {
          "type": "string",
          "minLength": 1
        },
        "revoked_at": {
          "type": "string",
          "pattern": "^[0-9]{4}-[0-9]{2}-[0-9]{2}T[0-9]{2}:[0-9]{2}:[0-9]{2}(\\.[0-9]+)?(Z|z|[+-](0[0-9]|1[0-9]|2[0-3]):[0-5][0-9])$"
        }
      },
      "required": [
        "status"
      ]
    }
  },
  "$defs": {
    "claim": {
      "type": "object",
      "additionalProperties": false,
      "required": [
        "claim_id",
        "statement",
        "status"
      ],
      "properties": {
        "claim_id": {
          "type": "string",
          "pattern": "^CLM-[0-9]{6}$"
        },
        "statement": {
          "type": "string",
          "minLength": 1
        },
        "status": {
          "type": "string",
          "enum": [
            "VERIFIED",
            "SOURCE-VERIFIED",
            "SELF-CLAIMED",
            "REVOKED"
          ]
        },
        "source": {
          "type": "object",
          "additionalProperties": false,
          "properties": {
            "type": {
              "type": "string",
              "enum": [
                "official_website",
                "domain_control",
                "public_record",
                "authorized_document",
                "third_party_source",
                "self_attestation"
              ]
            },
            "reference": {
              "type": "string",
              "minLength": 1
            },
            "checked_at": {
              "type": "string",
              "pattern": "^[0-9]{4}-[0-9]{2}-[0-9]{2}T[0-9]{2}:[0-9]{2}:[0-9]{2}(\\.[0-9]+)?(Z|z|[+-](0[0-9]|1[0-9]|2[0-3]):[0-5][0-9])$"
            }
          }
        },
        "authorization": {
          "type": "object",
          "additionalProperties": false,
          "properties": {
            "status": {
              "type": "string",
              "enum": [
                "CONFIRMED",
                "NOT_CONFIRMED"
              ]
            },
            "method": {
              "type": "string",
              "minLength": 1
            }
          }
        },
        "valid_from": {
          "type": "string",
          "pattern": "^[0-9]{4}-[0-9]{2}-[0-9]{2}T[0-9]{2}:[0-9]{2}:[0-9]{2}(\\.[0-9]+)?(Z|z|[+-](0[0-9]|1[0-9]|2[0-3]):[0-5][0-9])$"
        },
        "valid_until": {
          "type": "string",
          "pattern": "^[0-9]{4}-[0-9]{2}-[0-9]{2}T[0-9]{2}:[0-9]{2}:[0-9]{2}(\\.[0-9]+)?(Z|z|[+-](0[0-9]|1[0-9]|2[0-3]):[0-5][0-9])$"
        }
      }
    }
  }
}
